[
  {
    "food_id": "gh-jollof-rice",
    "name": "Jollof rice",
    "alt_names": ["jollof", "party rice"],
    "kcal_per_100g": 165.0,
    "protein_g_per_100g": 4.0,
    "fat_g_per_100g": 5.5,
    "carbs_g_per_100g": 26.0,
    "portion_defaults": [
      {"label": "1 plate of jollof", "grams": 350},
      {"label": "1 cup", "grams": 200},
      {"label": "100 g", "grams": 100}
    ],
    "category": "staple",
    "source": "wafct_composite",
    "source_confidence": "medium"
  },
  {
    "food_id": "gh-plain-rice",
    "name": "Plain boiled rice",
    "alt_names": ["WAFCT-04-001", "white rice"],
    "kcal_per_100g": 130.0,
    "protein_g_per_100g": 2.7,
    "fat_g_per_100g": 0.3,
    "carbs_g_per_100g": 28.2,
    "portion_defaults": [
      {"label": "1 plate of rice", "grams": 300},
      {"label": "1 cup", "grams": 200},
      {"label": "100 g", "grams": 100}
    ],
    "category": "staple",
    "source": "wafct",
    "source_confidence": "high"
  },
  {
    "food_id": "gh-banku",
    "name": "Banku",
    "alt_names": ["fermented corn and cassava dough", "akpele"],
    "kcal_per_100g": 145.0,
    "protein_g_per_100g": 2.3,
    "fat_g_per_100g": 0.5,
    "carbs_g_per_100g": 32.0,
    "portion_defaults": [
      {"label": "1 ball of banku", "grams": 200},
      {"label": "1 medium ball", "grams": 150},
      {"label": "100 g", "grams": 100}
    ],
    "category": "staple",
    "source": "wafct_composite",
    "source_confidence": "medium"
  },
  {
    "food_id": "gh-fufu-cassava-plantain",
    "name": "Fufu (cassava and plantain)",
    "alt_names": ["fufuo", "pounded fufu"],
    "kcal_per_100g": 155.0,
    "protein_g_per_100g": 1.3,
    "fat_g_per_100g": 0.3,
    "carbs_g_per_100g": 37.5,
    "portion_defaults": [
      {"label": "1 ball of fufu", "grams": 250},
      {"label": "1 medium ball", "grams": 180},
      {"label": "100 g", "grams": 100}
    ],
    "category": "staple",
    "source": "wafct_composite",
    "source_confidence": "medium"
  },
  {
    "food_id": "gh-kenkey-ga",
    "name": "Ga kenkey",
    "alt_names": ["WAFCT-09-302", "ga kenkey", "komi"],
    "kcal_per_100g": 175.0,
    "protein_g_per_100g": 3.5,
    "fat_g_per_100g": 0.8,
    "carbs_g_per_100g": 39.0,
    "portion_defaults": [
      {"label": "1 kenkey ball", "grams": 220},
      {"label": "1 small ball", "grams": 150},
      {"label": "100 g", "grams": 100}
    ],
    "category": "staple",
    "source": "wafct",
    "source_confidence": "high"
  },
  {
    "food_id": "gh-kenkey-fante",
    "name": "Fante kenkey",
    "alt_names": ["dorkono", "fante kenkey"],
    "kcal_per_100g": 165.0,
    "protein_g_per_100g": 3.2,
    "fat_g_per_100g": 0.7,
    "carbs_g_per_100g": 37.0,
    "portion_defaults": [
      {"label": "1 kenkey ball", "grams": 220},
      {"label": "1 small ball", "grams": 150},
      {"label": "100 g", "grams": 100}
    ],
    "category": "staple",
    "source": "wafct",
    "source_confidence": "high"
  },
  {
    "food_id": "gh-waakye",
    "name": "Waakye (rice and beans)",
    "alt_names": ["rice and beans", "waakye plain"],
    "kcal_per_100g": 150.0,
    "protein_g_per_100g": 5.5,
    "fat_g_per_100g": 1.5,
    "carbs_g_per_100g": 29.0,
    "portion_defaults": [
      {"label": "1 plate of waakye", "grams": 350},
      {"label": "1 cup", "grams": 200},
      {"label": "100 g", "grams": 100}
    ],
    "category": "staple",
    "source": "wafct_composite",
    "source_confidence": "medium"
  },
  {
    "food_id": "gh-tuo-zaafi",
    "name": "Tuo zaafi",
    "alt_names": ["tz", "northern corn mash"],
    "kcal_per_100g": 140.0,
    "protein_g_per_100g": 2.5,
    "fat_g_per_100g": 0.6,
    "carbs_g_per_100g": 31.0,
    "portion_defaults": [
      {"label": "1 ball of tuo zaafi", "grams": 250},
      {"label": "1 medium ball", "grams": 180},
      {"label": "100 g", "grams": 100}
    ],
    "category": "staple",
    "source": "wafct_composite",
    "source_confidence": "medium"
  },
  {
    "food_id": "gh-light-soup",
    "name": "Light soup",
    "alt_names": ["nkrakra", "spicy tomato broth"],
    "kcal_per_100g": 55.0,
    "protein_g_per_100g": 5.0,
    "fat_g_per_100g": 2.5,
    "carbs_g_per_100g": 3.0,
    "portion_defaults": [
      {"label": "1 bowl of light soup", "grams": 300},
      {"label": "1 small bowl", "grams": 200},
      {"label": "100 g", "grams": 100}
    ],
    "category": "soup_stew",
    "source": "wafct_composite",
    "source_confidence": "medium"
  },
  {
    "food_id": "gh-groundnut-soup",
    "name": "Groundnut soup",
    "alt_names": ["peanut soup", "nkatenkwan"],
    "kcal_per_100g": 110.0,
    "protein_g_per_100g": 7.0,
    "fat_g_per_100g": 7.0,
    "carbs_g_per_100g": 4.5,
    "portion_defaults": [
      {"label": "1 bowl of groundnut soup", "grams": 300},
      {"label": "1 small bowl", "grams": 200},
      {"label": "100 g", "grams": 100}
    ],
    "category": "soup_stew",
    "source": "wafct_composite",
    "source_confidence": "medium"
  },
  {
    "food_id": "gh-palm-nut-soup",
    "name": "Palm-nut soup",
    "alt_names": ["abenkwan", "palm soup"],
    "kcal_per_100g": 85.0,
    "protein_g_per_100g": 4.0,
    "fat_g_per_100g": 7.0,
    "carbs_g_per_100g": 1.5,
    "portion_defaults": [
      {"label": "1 bowl of palm-nut soup", "grams": 300},
      {"label": "1 small bowl", "grams": 200},
      {"label": "100 g", "grams": 100}
    ],
    "category": "soup_stew",
    "source": "wafct_composite",
    "source_confidence": "medium"
  },
  {
    "food_id": "gh-kontomire",
    "name": "Kontomire stew",
    "alt_names": ["palaver sauce", "cocoyam leaves stew", "abom"],
    "kcal_per_100g": 95.0,
    "protein_g_per_100g": 6.0,
    "fat_g_per_100g": 7.0,
    "carbs_g_per_100g": 2.0,
    "portion_defaults": [
      {"label": "1 serving of kontomire", "grams": 200},
      {"label": "1 small bowl", "grams": 150},
      {"label": "100 g", "grams": 100}
    ],
    "category": "soup_stew",
    "source": "wafct_composite",
    "source_confidence": "low"
  },
  {
    "food_id": "gh-okro-stew",
    "name": "Okro stew",
    "alt_names": ["okra stew", "okro"],
    "kcal_per_100g": 75.0,
    "protein_g_per_100g": 4.5,
    "fat_g_per_100g": 4.5,
    "carbs_g_per_100g": 3.5,
    "portion_defaults": [
      {"label": "1 bowl of okro stew", "grams": 250},
      {"label": "1 serving", "grams": 180},
      {"label": "100 g", "grams": 100}
    ],
    "category": "soup_stew",
    "source": "wafct_composite",
    "source_confidence": "medium"
  },
  {
    "food_id": "gh-shito",
    "name": "Shito (Ghanaian hot pepper sauce)",
    "alt_names": ["black pepper sauce", "shitor"],
    "kcal_per_100g": 320.0,
    "protein_g_per_100g": 8.0,
    "fat_g_per_100g": 28.0,
    "carbs_g_per_100g": 8.0,
    "portion_defaults": [
      {"label": "1 dollop of shito", "grams": 30},
      {"label": "1 tablespoon", "grams": 15},
      {"label": "1 small jar", "grams": 50}
    ],
    "category": "soup_stew",
    "source": "wafct_composite",
    "source_confidence": "low"
  },
  {
    "food_id": "gh-tilapia-grilled",
    "name": "Grilled tilapia",
    "alt_names": ["WAFCT-13-105", "tilapia", "fried tilapia"],
    "kcal_per_100g": 130.0,
    "protein_g_per_100g": 26.0,
    "fat_g_per_100g": 3.0,
    "carbs_g_per_100g": 0.0,
    "portion_defaults": [
      {"label": "1 medium tilapia", "grams": 250},
      {"label": "1 large tilapia", "grams": 350},
      {"label": "100 g", "grams": 100}
    ],
    "category": "protein",
    "source": "wafct",
    "source_confidence": "high"
  },
  {
    "food_id": "gh-chicken-thigh-grilled",
    "name": "Grilled chicken thigh",
    "alt_names": ["chicken", "khebab chicken"],
    "kcal_per_100g": 209.0,
    "protein_g_per_100g": 26.0,
    "fat_g_per_100g": 11.0,
    "carbs_g_per_100g": 0.0,
    "portion_defaults": [
      {"label": "1 chicken thigh", "grams": 180},
      {"label": "1 chicken drumstick", "grams": 110},
      {"label": "100 g", "grams": 100}
    ],
    "category": "protein",
    "source": "usda",
    "source_confidence": "high"
  },
  {
    "food_id": "gh-beef-stew",
    "name": "Beef stew",
    "alt_names": ["nkwan", "beef tomato stew"],
    "kcal_per_100g": 195.0,
    "protein_g_per_100g": 16.0,
    "fat_g_per_100g": 13.0,
    "carbs_g_per_100g": 3.0,
    "portion_defaults": [
      {"label": "1 serving of beef stew", "grams": 200},
      {"label": "1 small bowl", "grams": 150},
      {"label": "100 g", "grams": 100}
    ],
    "category": "protein",
    "source": "wafct_composite",
    "source_confidence": "medium"
  },
  {
    "food_id": "gh-koobi",
    "name": "Koobi (salted tilapia)",
    "alt_names": ["salted fish", "koobi tilapia"],
    "kcal_per_100g": 150.0,
    "protein_g_per_100g": 28.0,
    "fat_g_per_100g": 4.0,
    "carbs_g_per_100g": 0.0,
    "portion_defaults": [
      {"label": "1 small piece of koobi", "grams": 60},
      {"label": "1 medium piece", "grams": 100},
      {"label": "100 g", "grams": 100}
    ],
    "category": "protein",
    "source": "wafct",
    "source_confidence": "medium"
  },
  {
    "food_id": "gh-wele",
    "name": "Wele (cow skin)",
    "alt_names": ["pomo", "kpomo", "cow skin"],
    "kcal_per_100g": 220.0,
    "protein_g_per_100g": 36.0,
    "fat_g_per_100g": 8.0,
    "carbs_g_per_100g": 0.0,
    "portion_defaults": [
      {"label": "1 piece of wele", "grams": 50},
      {"label": "2 pieces of wele", "grams": 100},
      {"label": "100 g", "grams": 100}
    ],
    "category": "protein",
    "source": "wafct",
    "source_confidence": "medium"
  },
  {
    "food_id": "gh-kelewele",
    "name": "Kelewele (spicy fried plantain)",
    "alt_names": ["spicy plantain", "fried plantain spiced"],
    "kcal_per_100g": 250.0,
    "protein_g_per_100g": 1.5,
    "fat_g_per_100g": 11.0,
    "carbs_g_per_100g": 36.0,
    "portion_defaults": [
      {"label": "1 serving of kelewele", "grams": 150},
      {"label": "1 small cup", "grams": 100},
      {"label": "1 large serving", "grams": 250}
    ],
    "category": "side_snack",